Title,Description,Article URL,Image URL,Premium,Byline,Article Type
 France's must-see art exhibitions this summer  ,"Le Monde's critics present our selection of exhibitions on painting, contemporary art and photography across France.",https://www.lemonde.fr/en/culture/article/2026/07/19/france-s-must-see-art-exhibitions-this-summer_6755615_30.html,https://img.lemde.fr/2026/06/30/0/0/960/640/400/266/75/0/7c620db_upload-1-tnnb4we2voct-1f9859f2acf9603a859f2acf9b6a85v-960x640.jpg,Premium,,
US launches new airstrikes to 'punish' Iran after two troops killed,,https://www.lemonde.fr/en/international/article/2026/07/18/iran-threatens-unforgettable-lessons-as-two-us-troops-killed_6755608_4.html,https://img.lemde.fr/2026/07/18/0/0/6000/4000/398/265/75/0/8f49b08_ftp-1-rdmvgdkedltq-5653389-01-06.jpg,,,
'Can we continue to entrust global sport to organizations more concerned with their financial interests than with the public good?',,https://www.lemonde.fr/en/opinion/article/2026/07/19/can-we-continue-to-entrust-global-sport-to-organizations-more-concerned-with-their-financial-interests-than-with-the-public-good_6755619_23.html,https://img.lemde.fr/2026/06/26/0/0/1500/1000/398/265/75/0/fbaed81_upload-1-jmitx2xp6sco-frame-1468.jpg,Premium,,
War is undermining social contract between Putin and Russians,"The spread of Ukrainian attacks across the country is deepening Russians' concerns about the regime's ability to protect their basic needs, as the economic situation deteriorates.",https://www.lemonde.fr/en/international/article/2026/07/19/war-is-undermining-social-contract-between-putin-and-russians_6755611_4.html,https://img.lemde.fr/2026/07/10/0/0/7788/5192/398/265/75/0/cfc86c6_ftp-1-i27ny47kipey-5585549-01-06.jpg,Premium,,
Influencer Andrew Tate and brother Tristan arrested in Miami,"The brothers, notorious for promoting aggressively misogynistic views to millions of their followers on social media, were arrested on Saturday by US marshals. The United Kingdom is seeking their extradition to face new charges of rape, sex trafficking and assault.",https://www.lemonde.fr/en/international/article/2026/07/19/influencer-andrew-tate-and-brother-tristan-arrested-in-miami_6755614_4.html,https://img.lemde.fr/2025/05/28/0/0/4008/2672/398/265/75/0/eda6e0b_ftp-import-images-1-j7ttftxratm3-d8d1adaa391b454f8c56c600728fdd06-0-e776598f0b344c45a4011555cbd4570b.jpg,,,
"BTS electrifies Stade de France, seven years after their last Paris concert",The world tour of the industry's most powerful K-pop group wrapped up its European leg in Saint-Denis on July 17 and July 18.,https://www.lemonde.fr/en/culture/article/2026/07/19/bts-electrifies-stade-de-france-seven-years-after-their-last-paris-concert_6755618_30.html,https://img.lemde.fr/2026/03/20/100/76/2871/1914/398/265/75/0/f701939_ftp-1-5xcd2qgb06f6-ed6c07d21f144f79b90c882517d29dfd-0-f4093857ac124d28943c2804f6f555be.jpg,Premium,,
"Inside the court of France's richest man, Bernard Arnault",'Bernard Arnault's Empire' (1/6). The billionaire at the head of LVMH is as secretive as he is powerful. He relies on a devoted entourage in which a mix of fear and admiration prevails.,https://www.lemonde.fr/en/summer-reads/article/2026/07/19/bernard-arnault-inside-the-court-of-france-s-richest-man_6755617_183.html,https://img.lemde.fr/2026/07/16/1736/0/4000/2666/664/442/75/0/3630522_upload-1-tarby5yocvaj-l1070311.jpg,Premium, Raphaëlle Bacqué and  Vanessa Schneider,Investigation
England beat France 6-4 in chaotic World Cup bronze match,,https://www.lemonde.fr/en/sports/article/2026/07/19/england-beat-france-6-4-in-chaotic-world-cup-bronze-match_6755612_9.html,https://img.lemde.fr/2026/07/18/0/0/5121/3414/198/132/95/0/df31509_ftp-1-hqciubefh3ar-5654841-01-06.jpg,,,
"In a world in turmoil, 'Hamlet' has never been more relevant",,https://www.lemonde.fr/en/opinion/article/2026/07/19/in-a-world-in-turmoil-hamlet-has-never-been-more-relevant_6755613_23.html,https://img.lemde.fr/2026/06/29/101/0/1600/1066/198/132/95/0/ead20ad_upload-1-xjtgemfvd4c9-bertrand-de-roffignac-nikita-kukushkin-hamlet-fantomes-thomas-amouroux-theatre-du-chatelet.jpg,Premium,,
"'We are trapped in a climate dystopia, a black comedy scenario, where the grotesque rivals the Orwellian farce'",,https://www.lemonde.fr/en/opinion/article/2026/07/18/we-are-trapped-in-a-climate-dystopia-a-black-comedy-scenario-where-the-grotesque-rivals-the-orwellian-farce_6755609_23.html,https://img.lemde.fr/2026/07/06/0/0/7753/5169/198/132/95/0/d58f295_upload-1-q9lm1yyyxxmn-000-b9dq8ew.jpg,Premium,,
"Christophe B., an ordinary man accused of extraordinary violence in 'libertine' rapes",,https://www.lemonde.fr/en/france/article/2026/07/18/christophe-b-an-ordinary-man-accused-of-extraordinary-violence-in-libertine-rapes_6755598_7.html,https://img.lemde.fr/2026/07/14/1285/0/4252/2834/198/132/95/0/680b431_upload-1-klwb4htej1p7-bordeaux-viol-2.jpg,Premium,,
NY mayor in talks over whether to arrest Netanyahu at upcoming UN summit,,https://www.lemonde.fr/en/international/article/2026/07/19/ny-mayor-in-talks-over-whether-to-arrest-netanyahu-at-upcoming-un-summit_6755616_4.html,,,,
Wildfire haze hangs over eastern US ahead of World Cup final,,https://www.lemonde.fr/en/international/article/2026/07/19/wildfire-haze-hangs-over-eastern-us-ahead-of-world-cup-final_6755610_4.html,,,,
"Death toll from Venezuela quakes rises to 5,119",,https://www.lemonde.fr/en/international/article/2026/07/18/venezuela-quake-death-toll-exceeds-5-000-as-imf-releases-funds_6755595_4.html,,,,
How Dakar caught surfing's new wave: 'It has become a path to success and a way of life',,https://www.lemonde.fr/en/le-monde-africa/article/2026/07/18/how-dakar-caught-surfing-s-new-wave-it-has-become-a-path-to-success-and-a-way-of-life_6755607_124.html,,Premium,,
"After three heatwaves, French people worry: 'Next year will be worse. How will we cope?'",,https://www.lemonde.fr/en/environment/article/2026/07/18/after-three-heatwaves-french-people-worry-next-year-will-be-worse-how-will-we-cope_6755606_114.html,,Premium,,
Bayeux Tapestry arrives in London for forthcoming display at British Museum,,https://www.lemonde.fr/en/culture/article/2026/07/18/bayeux-tapestry-arrives-in-london-for-forthcoming-display-at-british-museum_6755599_30.html,,Premium,,
Hungary's new government dismantles Orban-era think tanks,,https://www.lemonde.fr/en/international/article/2026/07/18/hungary-s-new-government-dismantles-orban-era-think-tanks_6755601_4.html,,Premium,,
Artificial intelligence: Xi Jinping promotes open and accessible Chinese alternative to challenge the US,,https://www.lemonde.fr/en/economy/article/2026/07/18/artificial-intelligence-xi-jinping-promotes-open-and-accessible-chinese-alternative-to-challenge-the-us_6755604_19.html,,Premium,,
19 men charged in mass rapes case among 'libertines' in France,"A man identified as Christophe B. is accused of having forced six former partners into extremely violent sexual encounters with dozens of men recruited online over a period of more than 20 years, under the guise of 'libertinism.'",https://www.lemonde.fr/en/france/article/2026/07/17/19-men-charged-in-mass-rapes-case-among-libertines-in-france_6755571_7.html,https://img.lemde.fr/2026/07/14/1807/0/4252/2834/664/442/75/0/0aa5ac5_upload-1-kt230soit05h-bordeaux-viol-1-def.jpg,Premium, Jérôme Lefilliâtre and  Lorraine de Foucher ,Investigation
Visualize the full extent of wildfires across Europe in recent weeks,The burned areas across the European continent have already far surpassed levels seen in recent years and are now approaching the maximum recorded in 2025.,https://www.lemonde.fr/en/les-decodeurs/article/2026/07/14/visualize-the-full-extent-of-wildfires-across-europe-in-recent-weeks_6755451_8.html,https://img.lemde.fr/2026/07/10/0/0/3840/2560/664/442/75/0/f3c2a33_upload-1-pzmr8dmczv5t-media-d-appel-light.png,Premium, Pierre Breteau,In Graphs
Frontex continuing mission in Greece despite serious violations of migrants' rights,"How long will Frontex tolerate the growing violations of migrants' rights in Greece? A Le Monde investigation documents the many warnings issued by the Fundamental Rights Office of the European agency, which have so far failed to prompt meaningful action.",https://www.lemonde.fr/en/les-decodeurs/article/2026/07/18/frontex-continuing-mission-in-greece-despite-serious-violations-of-migrants-rights_6755593_8.html,https://img.lemde.fr/2026/07/17/0/0/3543/2362/664/442/75/0/de7c267_upload-1-bkn4sl0ezsba-2026-02-21t135719z-1741947265-rc2bqjabvhzw-rtrmadp-3-migration-europe-greece-shipwreck.JPG,Premium, Franziska Grillmeier and  Ludek Stavinoha,Investigation
Donald Trump and his troubling electoral obsessions,,https://www.lemonde.fr/en/opinion/article/2026/07/18/donald-trump-and-his-troubling-electoral-obsessions_6755603_23.html,,,,Editorial
'It would have been enough to learn the terrible lessons from Gaza to anticipate the current impasse over Iran',,https://www.lemonde.fr/en/international/article/2026/07/12/it-would-have-been-enough-to-learn-the-terrible-lessons-from-gaza-to-anticipate-the-current-impasse-over-iran_6755416_4.html,https://img.lemde.fr/2023/07/31/0/0/0/0/100/100/60/0/d45bb07_1690791602941-eac5c14-1647333440018-jean-pierre-filiu-2019.jpg,Premium,,Column
Addressing rape culture to better denounce it,,https://www.lemonde.fr/en/opinion/article/2026/07/17/addressing-rape-culture-to-better-denounce-it_6755572_23.html,,,,Editorial
